{
  "schemaVersion": 4,
  "companyName": "Bizarre Industries",
  "tagline": "CATCH THE STARS",
  "taglineMeaning": "Make the distant tangible",
  "accent": {
    "name": "Signal Lime",
    "value": "#C6FF24"
  },
  "mark": {
    "name": "Gravity Well",
    "geometry": "invariant",
    "approvedFigureColors": [
      "Signal Lime",
      "Black"
    ],
    "mixedFigureColorAllowed": false
  },
  "typography": {
    "display": "Unbounded",
    "stencil": "Big Shoulders Stencil",
    "body": "Hanken Grotesk",
    "mono": "JetBrains Mono"
  },
  "layoutModes": ["Precision Panel", "Display Field"],
  "identityModel": {
    "model": "single-identity",
    "publicIdentity": "Bizarre Industries",
    "subbrandsAllowed": false,
    "childBrandsAllowed": false
  },
  "productIntegration": {
    "principle": "integrate-not-replace",
    "auditBeforeStyling": true,
    "hostSystemFirst": true,
    "conflictResolution": "host-convention-wins",
    "hostBehavior": "preserve",
    "hostVisualLanguage": "preserve",
    "bizarreExpression": "restrained-recognition-layer",
    "platformProfiles": {
      "web": {
        "implementationLayer": "host-framework",
        "implementationIsVisualLanguage": false,
        "preserve": ["existing-component-system", "semantic-html", "browser-conventions"]
      },
      "ios": {
        "framework": "SwiftUI",
        "preserve": ["system-controls", "navigation", "typography", "accessibility", "touch-input", "motion"]
      },
      "macos": {
        "framework": "SwiftUI",
        "preserve": ["system-controls", "windows", "menus", "typography", "accessibility", "keyboard-and-precision-input", "motion"]
      },
      "other": {
        "entryCondition": "audit-existing-infrastructure"
      }
    }
  },
  "themeOrder": ["void", "paper", "void-hicontrast", "workshop", "bone"]
}
